model_slug,score,source,source_url,evaluated_at,notes
claude-opus-4-5-high,80,self-reported,https://www-cdn.anthropic.com/bf10f64990cfda0ba858290be7b8cc6317685f47.pdf,2025-11-24,Per the system card (Section 2.10): 'The ARC Prize Foundation reports that Claude Opus 4.5 achieved 80.0% on ARC-AGI-1 ... with 64k thinking tokens on their private dataset.'
gpt-5-2,86.2,self-reported,https://openai.com/index/introducing-gpt-5-2/,,"ARC-AGI-1 Verified, GPT-5.2 Thinking; confirmed"
gpt-5-4,93.7,self-reported,https://the-decoder.com/openai-launches-gpt-5-4-thinking-and-pro-combining-coding-reasoning-and-computer-use-in-one-model/,,ARC-AGI-1 (Pro variant scores 94.5)
gpt-5-4-pro,94.5,self-reported,https://the-decoder.com/openai-launches-gpt-5-4-thinking-and-pro-combining-coding-reasoning-and-computer-use-in-one-model/,2026-03-05,ARC-AGI-1 (Verified). Cross-confirmed by DataLearnerAI (94.50).
gpt-5-nano,20.7,independent,https://themodelbeat.com/models/gpt-5-nano,,"ARC-AGI (v1) score from Epoch AI's independent evaluation of GPT-5 nano, relayed via themodelbeat.com."
gpt-5-pro,70.2,independent,https://epoch.ai/models/gpt-5-pro,,Epoch AI's independent ARC-AGI-1 evaluation of GPT-5 Pro.
grok-4,66.6,independent,https://www.datacamp.com/blog/grok-4,2025-07-09,"ARC-AGI v1 (semi-private eval), independently verified by the ARC Prize Foundation; corroborated by a second independent source (gpt.gekko.de) citing the same 66.6% figure."
