model_slug,score,source,source_url,evaluated_at,notes
chinchilla,65.1,self-reported,https://arxiv.org/abs/2203.15556,,Average accuracy across 62 BIG-bench tasks
galactica-120b,48.7,self-reported,https://ar5iv.labs.arxiv.org/html/2211.09085,2022-11-01,"Weighted accuracy across a 57-task BIG-bench subset, Table 12"
glm-130b,13.31,self-reported,https://arxiv.org/pdf/2210.02414,2022-10-05,"BIG-bench-lite (24 tasks), zero-shot accuracy, Table 4 of the GLM-130B paper (arXiv:2210.02414). Paper states GLM-130B outperforms GPT-3 175B (4.35 zero-shot) and even PaLM 540B in this zero-shot setting; also reports 1-shot=14.91 and 3-shot=15.12 for GLM-130B, but few-shot gains are smaller than GPT-3's. This is a genuinely new benchmark not previously tracked for this model (previously only LAMBADA and MMLU were tracked)."
gopher,54.4,self-reported,https://arxiv.org/abs/2203.15556,,"Average accuracy across 62 BIG-bench tasks, reported in Chinchilla paper"
nous-hermes-2-mixtral-8x7b-dpo,49.7,self-reported,https://huggingface.co/NousResearch/Nous-Hermes-2-Mixtral-8x7B-DPO,,BigBench average (custom subset used by Nous)
openhermes-2-5-mistral-7b,40.96,self-reported,https://huggingface.co/teknium/OpenHermes-2.5-Mistral-7B,,BigBench average (custom subset used by Nous/Teknium)
stablelm-zephyr-3b,35.26,self-reported,https://huggingface.co/stabilityai/stablelm-zephyr-3b,,'BigBench (Avg)' row of the 'Other benchmarks' table in the official HF model card README.
