model_slug,score,source,source_url,evaluated_at,notes
claude-3-5-sonnet-new,14.9,self-reported,https://www.anthropic.com/news/3-5-models-and-computer-use,,PROPOSED NEW SLUG 'osworld' (screenshot-only computer-use configuration; distinct from the newer 'osworld-verified' proposed elsewhere in this batch). Extended-steps configuration scored 22.0%.
claude-opus-4-1,44.4,self-reported,https://www-cdn.anthropic.com/bf10f64990cfda0ba858290be7b8cc6317685f47.pdf,2025-11-24,"OSWorld-Verified computer-use score for Opus 4.1, likewise only published retroactively in Claude Opus 4.5's Nov-2025 system card/launch comparison table (Opus 4.1's own launch page did not test computer use). [benchmarkSlug corrected during round-5 full-corpus accuracy re-verify: osworld-verified -> osworld, same score]"
nemotron-3-nano-omni,47.4,self-reported,https://arxiv.org/abs/2604.24954,2026-04-27,"OSWorld (agentic computer-use benchmark), reasoning-on mode, from Table 7 of the NVIDIA technical report, confirmed via pdftotext -layout extraction: 'OSWorld - 47.4' (reasoning-off not reported / reasoning-on = 47.4). Only the reasoning-on figure exists for this model."
qwen2-5-vl-72b,8.83,self-reported,https://huggingface.co/Qwen/Qwen2.5-VL-72B-Instruct,2025-01-28,"Agent/computer-use benchmark, success rate, from the official 'Agent benchmark' table"
seed-2-1-pro,78.8,self-reported,https://lf3-static.bytednsdoc.com/obj/eden-cn/lapzild-tss/ljhwZthlaukjlkulzlp/seed2.1/Seed2_1_Model_Card.pdf,,"OSWorld, Table 4 ('Generalist Computer-Use Agent evaluation') of the official model card: Seed2.1-Pro reaches 78.8 under the 'Generalist CUA' setting (agent may issue Bash commands/scripts alongside GUI actions), up from a 72.6 GUI-only baseline -- this matches this corpus's existing 'osworld' slug convention (generic, non-'-verified' computer-use runs). GPT-5.5 78.7, Claude-4.7-Opus 82.8, Gemini-3.1-Pro 76.2, Seed2.1-Turbo 76.4. Flagging one internal inconsistency for transparency: Section 2.5.1's prose states 'Seed2.1-Pro reaches 78.2', which conflicts with Table 4 and Figure 5's narrative ('Success rises from 72.6% to 78.8% (Pro)') on the same result -- I used 78.8 since two independent parts of the document (table + figure caption) agree on it against the single conflicting prose sentence."
