model_slug,score,source,source_url,evaluated_at,notes
qwen3-6-27b,77.2,self-reported,https://qwen.ai/blog?id=qwen3.6-27b,,SWE-bench Verified; beats Qwen3.5-397B-A17B's 76.2 despite ~15x fewer total params. Independently corroborated at the same value (77.2%) by localaimaster.com's third-party review.
qwen3-6-35b-a3b,73.4,self-reported,https://qwen.ai/blog?id=qwen3.6-27b,,SWE-bench Verified; matches the value on its own HF model card's launch comparison table
qwen3-6-plus,78.8,independent,https://openrouter.ai/qwen/qwen3.6-plus/benchmarks,,"SWE-bench Verified, resolved rate. Attributed specifically to the hosted Qwen3.6-Plus tier (not the open-weight Qwen3.6-35B-A3B, which independently scores a distinctly lower 73.4% per a DEV Community writeup of the HF release -- good disambiguation signal against variant-conflation). Corroborated by a second aggregator, benchlm.ai (https://benchlm.ai/models/qwen3-6-plus, same figure, tagged 'Provider source'), and loosely by a third-party social post. Could not verify against Alibaba's own primary blog because its comparison table is embedded as images, unreadable via text fetch. Confidence: moderate -- two aggregators agree and the number is well clear of the smaller sibling model's score, but neither aggregator is the primary source."
qwen3-7-max,80.4,self-reported,https://www.alibabacloud.com/blog/qwen3-7-the-agent-frontier_603154,,"Listed as 'SWE-Verified' (SWE-bench Verified) on Alibaba Cloud's own official launch blog, confirmed via direct fetch; independently corroborated at the identical value by three separate secondary write-ups (DataCamp, a Weights & Biases report, and CodingFleet), all of which explicitly cite the Alibaba blog as their source. This is the same figure the corpus's existing verificationNotes flagged as 'could not independently confirm' -- now confirmed directly."
qwen3-7-plus,77.7,self-reported,https://www.digitalapplied.com/blog/qwen-3-7-plus-alibaba-multimodal-agent-model-2026-release,,"SWE-Bench Verified, vendor-stated (Qwen's own launch benchmark table, run with thinking disabled). Qwen3.7-Plus trails Claude Opus 4.6 Max (80.8) and DeepSeek V4-Pro Max (80.6) on this metric."
qwen3-coder-480b-a35b,66.5,self-reported,https://qwenlm.github.io/blog/qwen3-coder/,,"SWE-bench Verified, Pass@1, no test-time scaling"
qwen3-max,69.6,self-reported,https://www.alibabacloud.com/blog/qwen3-max-just-scale-it_602621,,"SWE-bench Verified, Qwen3-Max-Preview (Instruct)"
sarvam-105b,45,self-reported,https://huggingface.co/sarvamai/sarvam-105b,2026-02-18,"SWE-Bench Verified, SWE-Agent harness"
seed-oss-36b,56,self-reported,https://huggingface.co/ByteDance-Seed/Seed-OSS-36B-Instruct,,"SWE-Bench Verified, OpenHands scaffold"
seed1-5-thinking,47,self-reported,https://github.com/ByteDance-Seed/Seed-Thinking-v1.5,,SWE-bench Verified
step-3-7-flash,76.5,self-reported,https://static.stepfun.com/blog/step-3.7-flash/,2026-05-29,"SWE-Bench Verified score from StepFun's official Step 3.7 Flash launch-blog benchmark table (own column: Step 3.7 Flash 76.5%, vs. e.g. Claude Opus 4.7 87.6%, GPT 5.5 not tested)."
trinity-large-thinking,63.2,self-reported,https://huggingface.co/arcee-ai/Trinity-Large-Thinking,,SWE-bench Verified
